22,더조은컴퓨터아트학원,{'모집분야': ['빅데이터 활용 \r\n                    응용SW개발자', '웹/앱디자인취업연수생\r\n                      [스마트기기UI/UX디자인\r\n                    양성과정]', '건축설계분야취업연수생\r\n                    [BIM건축설계/인테리어]', '웹프로그래머', '게임분야취업연수생\r\n                    [게임그래픽전문가양성]'], '교육분야': ['\n서버프로그래머\n\n클라이언트 프로그래머\n', '\n웹디자인\n\n웹퍼블리싱\n', '\nBIM 건축설계\n\n실내건축설계\r\n                          (인테리어)\n', '\n자바(JAVA)프레임워크 개발\n', '\n2D, 3D그래픽디자이너\n\n맵퍼\n\n애니메이터\n\n이펙트디자이너\n'], '자격요건': ['\n구직 희망자\n\n고등학교 및 대학교 졸업자\r\n                          및 17년 졸업예정자 \r\n                          (전문대, 학점은행제 포함)\n', '\n구직 희망자\n\n고등학교 및 대학교 졸업자\r\n                          및 17년 졸업예정자 \r\n                          (전문대, 학점은행제 포함)\n', '\n구직 희망자\n\n고등학교 및 대학교 졸업자\r\n                          및 17년 졸업예정자 \r\n                          (전문대, 학점은행제 포함)\n', '\n구직 희망자\n\n고등학교 및 대학교 졸업자\r\n                          및 17년 졸업예정자 \r\n                          (전문대, 학점은행제 포함)\n', '\n구직 희망자\n\n고등학교 및 대학교 졸업자\r\n                          및 17년 졸업예정자 \r\n                          (전문대, 학점은행제 포함)\n'], '인원\xa0': ['00명', '00명', '00명', '00명', '00명']}


24,㈜아이디어빈스,{'모집분야': ['개발자 (Java, JSP) ', '개발자 (Android, IOS) '], '담당업무': ['  Back-End 및 Front-End Java, JSP, Spring, mybatis, jquery 등 Linux, / Web / WAS  ', '  Android(Java) 앱 개발 Ios(Obj-c, Swift) 앱 개발 하이브리드 앱 개발 앱 유지보수  '], '자격요건': ['  자격요건 학력 : 초대졸이상 경력 : 3년 이상 ~ 12년 이하  우대사항 DB 설계 경험자 PM / PL 유경험자 ASP, PHP 경험자  ', '  자격요건 학력 : 초대졸이상 경력 : 3년 이상 ~ 10년 이하  우대사항 Java, Spring 개발 경험자 Los, Android 동시 가능자 정보처리기사  '], '인원': ['0명', '0명']}


26,(주)동서가구,{'모집분야': ['CS상담사', '웹디자이너', 'MD', '보조MD', '웹개발'], '담당업무': ['쇼핑몰 고객응대게시판 처리해피콜', '인터넷쇼핑몰웹디자인 관련 업무행사기획전, 배너제작상세페이지 제작홈페이지 관련 업무', '쇼핑몰 상품 운영행사진행상품관리, 기획제휴사 관리소품 MD 경력자 별도 모집', '메인 MD 보조업무사무보조 업무', 'PHP, MYSQL 프로그램 개발 및 유지보수ERP 시스템 프로그램개발 및 유지보수오라클, CSS'], '자격요건': ['학력 : 고졸이상경력 : 신입/경력[우대사항]CS업무에 대한 이해도와 적성이 맞는분성실하고 예의가 바른 분즉시출근 가능자, 동종업계 경력자대인관계 원만하신 분', '학력 : 초대졸이상경력 : 신입/경력[우대사항]쇼핑몰 경력 1년이상직무에 대한 이해도와 관련 스킬이 능숙한 분즉시출근 가능자, 동종업계 경력자대인관계 원만하신 분', '학력 : 초대졸이상경력 : 경력(1~2년도 가능)[우대사항]자사쇼핑몰 운영 경력 1년이상가구에 관심이 많은분성실하고 예의가 바른분즉시출근 가능자, 동종업계 경력자대인관계 원만하신 분', '학력 : 고졸이상경력 : 신입가능[우대사항]배움에 대한 의지가 강한분성실하고 예의가 바른 분즉시출근 가능자, 동종업계 경력자 대인관계 원만하신 분', '학력 : 무관경력 : 3년이상[우대사항]직무에 대한 이해도와 관련 스킬이 능숙한 분즉시출근 가능자, 동종업계 경력자대인관계 원만하신 분'], '모집인원 ': ['○명', '○명', '○명', '○명', '○명']}


28,㈜밀버스,{'모집분야': ['웹 솔루션 개발'], '담당업무': ['JAVA 기반 웹 솔루션 및 웹 서비스 개발'], '자격요건': ['  자격요건 학력 : 무관 신입 경력자 : 3년이상 성별 : 무관   기본요건 Back-End(Spring framework/myBatis/MySQL) Server(Apache Tomcat WAS Setting and Management) Secure Coding   우대사항 마케팅 솔루션 개발 경력 우대 기본요건 외 추가 개발 환경 경험 우대 포트폴리오 제출자 우대 서버관리 경험자 우대  '], '모집인원': ['00명']}


31,아시아블로이코리아㈜유니락,{'모집분야': ['연구 개발부 전자팀(경력)'], '담당업무': ['MCU 기반 펌웨어 개발용언어 : C,C++기타 제품 검증/디버깅'], '자격요건': ['IoT 개발 경험자 우대디지털락과 관련단품 또는 시스템 제품개발경력 : 5년 이상'], '인원': ['0명']}


32,㈜아이.비.에스,{'모집부문': ['JAVA ', ' 소프트웨어 시스템\xa0\xa0', '장비자동화'], '담당업무': ['SW개발', 'SW개발', '자동화 '], '전공 및 자격요건': ['[자격요건]웹 / 모바일 UX, UI 디자인 개발AWS / Cloud 관련업무Java Script 개발 [공통부문]학력 : 초대졸이상(2,3년)이상경력 : 경력(5년 이상)', ' [자격요건(시스템 개발)] Language : C#, .NET 등 DB : Orade 또는 MS-SQL 등 [공통부문] 학력 : 초대졸이상(2,3년)이상경력 : 신입 및 경력무관  ', '[자격요건(장비자동화)]  Language : C#, .NET, CIM, 모션제어, 머신비전 등 DB : Orade 또는 MS-SQL 등 [공통부문]  학력 : 초대졸이상(2,3년)이상 경력 : 경력(3년이상) '], '고용형태': [' 정규직프리랜서(근무기간:협의)', ' 정규직 프리랜서  \xa0(근무기간:협의) ', '정규직프리랜서  \xa0(근무기간:협의)  '], '인원': ['2 명', '0 명\xa0', '1 명']}


34,한국캐피탈㈜,{'모집부문 (직급)': ['영업 (차장)', '영업(대리)', 'IT(사원~대리) ', '론센터영업지원'], '고용형태': ['정규직 (○명)', '정규직(○명)', '정규직(○명)', '계약직(○명)'], '모집부문': ['경력', '경력', '경력', '신입 경력'], '담당업무 및 자격요건': [' 내구재 및 렌탈 영업 경력 5년이상 팀장급  금융업권 동일업무 경력자 우대  ', ' 내구재 및 렌탈 영업 경력 3년이상 대리급  금융업권 동일업무 경력자 우대 ', ' ERP시스템 개발 및 운영  Java, Java-script 개발가능자 우대 오라클 가능자 우대금융전산 개발 및 운영경력 1년이상 ', ' 론센터 가조회 및 서류접수업무 금융업권 동일업무 경력자 우대'], '근무지': ['서울', '서울', '서울', '서울 (강북)']}


35,㈜쓰리탑,{'부문': ['웹개발(JSP)', '웹개발(JSP)'], '구분': ['신입', '경력'], '인원': ['0명', '0명'], '담당업무': ['e-Commerce (대형 쇼핑몰 등)시스템 개발/유지보수', 'e-Commerce (대형 쇼핑몰 등)시스템 개발/유지보수'], '자격요건 및 우대사항': ['대졸 이상개발 관련 전공자JAVA(JSP), Oracle 가능자쇼핑몰 개발에 관심있는 자개발관련 교육센터 이수자 우대정보처리기사 자격증 보유자 우대', '초대졸 이상경력 3년 이상JAVA(JSP), Oracle 가능자e-commerce 시스템 개발 및 유관업무경험자 우대분석/설계 경험자 우대대규모 SI 프로젝트 경험자 우대정보처리기사 자격증 보유자 우대']}


38,㈜엘에이치,{'모집분야': ['디지털 마케팅 - 경력', '디지털 광고디자인- 신입- 경력', 'IT 개발- 경력', 'IT기획 (웹/앱)\xa0-경력\xa0'], '담당업무': ['  디지털 마케팅 전략수립 디지털 기반의 캠페인, 프로모션, 이벤트 기획 및 실행 효과적인 캠페인을 위한 매체기획 및 집행  ', '  디지털 프로모션 페이지 & 배너 제작 소셜미디어 운영 사이트 리뉴얼 및 유지보수  ', '  정형/비정형 데이터 분석엔진 연구/개발 통계, 데이터마이닝, 머신러닝 활용 분석 알고리즘 적용 또는 구현, 테스트를 위한(Python 등) 개발  머신러닝, 인공지능 기반 데이터 분석  데이터의 연구 분석과 다양한 문제에 대한 연구 및 솔루션 개발  ', '  Web, App 구축/운영 Web/App 운영 기획 업무 기능개선 및 신규 프로젝트 구축 업무 프로젝트 관리 및 커뮤니케이션  '], '자격요건': ['  디지털 마케팅 기획/실행 경력자 디지털 마케팅 유 경험자로 관련 지식과 기술 보유자 특정 광고주와 6개월 이상의 프로젝트 진행 경험자   우대사항 PC/MO 모두에 대한 퍼포먼스 마케팅 실무경험자 애드네트워크 및 각종 솔루션을 통한 분석 실무 경험자 게임 마케팅 실무 경험자 디지털 마케팅 대행사 및 미디어랩사 경력 우대 영어 가능자 우대 ', '  디자인 전공 포트폴리오   우대사항 광고마케팅 이해 아이데이션 경험 온라인 매체 경험 및 지식 ', '  Python ML/DL 분야에 대한 기본지식 및 학습의지 데이터 마이닝 또는 머신러닝 관련 프로젝트 경력   우대사항 Deep Learning Framework 사용(Scikit-Learn, Tensorflow, Caffe, Theano 등) 머신러닝을 통한 서비스 경험자 통계, 분석 능력자 ', '  웹기획 업무 경력 (3년 이상) 구축 프로젝트 A to Z 프로세스 이해   우대사항 PM/PL 프로젝트 경험  에이전시 경력 '], '모집인원': ['경력 0명(3년이상 대리/과장/차장)', '신입 0명경력 0명', '경력 0명 (3년 이상)', '경력 2명(5년이상 과장/차장)']}


39,㈜미디어로그,{'채용부문': ['서버 개발  (PM급/선임급/사원급 각 0명)', '통신분야 SI/SM'], '자격조건': ['  [필요스킬]  Spring 기반 Java 어플리케이션 개발 가능자 (DB 설계) HTML, Javascript를 이용한 Web UI 개발 가능자  [경력 (경력 연수가 다소 차이가 있어도 지원 가능)]  [PM] 8년 이상~ [선임급(대리~과장)] 5년~8년 이하 [사원급(선임~대리)] 3년 이상~5년 이하 ', '  [업무내용]  NMS Application 개발 및 운영  [필요스킬] 개발스킬 :  개발언어 : JAVA, Python(선택) 실시간/배치 서비스 개발 경험 개발환경 : Linux/Unix, Oracle/MySQL, MS-SQL  [경력]  3년 이상~8년 이하 '], '우대사항': ['  Linux, Tomcat, Apache 사용 가능자 우대 Oracle, MariaDB, MySQL 사용 가능 [PM] PM 경력자  ', '  통신분야 NMS 개발 경험자(네트워크 장비 모니터링, 제어 등) Network Programming 경험자 Open Source Software를 이용한 개발 경험자 (Hadoop, Kafka, Elasticsearch, MQ 등) HTML5, AngularJS 개발 경험자  '], '근무지': ['상암/평촌', '마곡/상암']}


41,드림원시스㈜,{'모집분야': ['솔류션팀', '웹팀', '고객지원팀'], '해당 공고 자세히 보기': [' 해당 공고 바로 클릭 ', ' 해당 공고 바로 클릭 ', ' 해당 공고 바로 클릭 '], '모집인원': ['○명', '○명', '○명']}


43,㈜비상교육,{'부문': ['출판', '출판', '출판', '교재혁신', '교재혁신', '교재혁신', '교재혁신', '사업전략', '교과서혁신', '교과서혁신', '디지털교육', '디지털교육', '디지털교육', '디지털교육', '디지털교육', '디지털교육', '디지털교육', '디지털교육', '디지털교육', '디지털교육', '디지털교육', '디지털교육', '디지털교육', '디지털교육', '디지털교육', '디지털교육', '디지털교육', '이러닝', '이러닝', '이러닝', '이러닝', 'T-Project', 'T-Project', '유아교육', 'T&P', '지원', '지원', '지원', '지원'], '요청부서': ['멀티미디어 개발', '플래닝', '문제은행 기획', '수학개발2', '초등수학', '초등수학', '과학개발2', '교과서 웹서비스 기획', '역사', '부도개발', '사업추진', '사업추진', '디지털서비스기획', '글로벌영업1', '교육전략', '교육전략', '한국어사업', '한국어사업', '디지털신사업', '디지털신사업', '디지털신사업', '디지털신사업', '디지털신사업', '디지털신사업', '스마트학습물 개발', '스마트학습물 개발', '스마트학습물 개발', '이러닝상품전략', '이러닝영상기획', '이러닝컨텐츠기획', '이러닝개발', 'T-Project', 'T-Project', '유아교육혁신', '웹커뮤니케이션', 'IT전략', '정보보안', '재무운용', '경영혁신'], '모집직무': ['동영상 촬영 및 콘텐츠 개발 지원', '디자인기획', '문항 편집 및 레이아웃 수정', '고등 수학교재 기획 및 개발', '초등 수학 교재 개발', '초등 수학 교재 개발', '고등 과학 교재 개발(물리학)', '웹기획', '역사 교과서, 교재 개발', '부도 편집 디자인', '웹기획', '영업기획', '웹기획', '해외영업 제휴업무', '초등 FC교육(국내)', '초등 FC교육(국내)', '웹&전략기획', '스마트 컨텐츠 기획', '초등영어 컨텐츠 기획/개발(PM급)', '초등영어 컨텐츠 기획/개발', '디지털 교수설계', '영상개발', '웹/모바일 시스템 기획(PM급)', '웹/모바일 서비스 기획', 'MSSQL운용/엑셀데이터처리/디지털콘텐츠개발', '온라인 학습물 기획', '스마트 학습물 제작', '마케팅', '이러닝영상기획', '이러닝컨텐츠기획', '웹개발', '센터운영 총괄', '웹/SNS 마케팅', '기획개발', '티스쿨 사이트 운영', 'IT인프라 전산담당 (서버/네트워크/보안)', '정보보안', '재무', '내부감사'], '직무내용 및 자격요건': ['[필요역량]동영상 촬영 경력 3년~5년스케치 및 인터뷰 촬영 가능자Adobe Premiere 로 기본 컷 편집 가능자캐논 5d mark2, mark3 운영 필수영상물 정보 기록 및 관리 가능자[면허/자격]운전 가능(필수)촬영 경력 3년 이상동영상 편집 가능[학력]전문대졸[경력]4~6(1~3)년', '[필요역량]크리에이티브 역량을 바탕으로한 적극적이고 주도적인 디자인 기획 업무 수행 능력.프로젝트를 전체적으로 파악하고, 전략적으로 크리에이티브를 기획하는 능력.디자인 트렌드에 대한 이해와 리서치 능력.자신의 생각을 말이나 이미지로 설득 할 수 있는 논리력과 구현능력.디자인 뿐 아니라, 다양한 분야에 대한 관심.다양한 분야의 동료들과의 대화 능력.[면허/자격]디자인 전공자광고, 홍보물 편집 디자인 유경험자디자인 개발 툴 능통자 (인디자인 ,포토샵, 일러스트)[학력]대졸[경력]신입(1~3년)', '[필요역량]초, 중, 고등 문항 한글 파일 편집 및 수식 입력긍정적인 마인드원활한 소통 및 협업 능력[면허/자격]한글, 엑셀 프로그램 사용 능력 중급 이상일러스트, 포토샵 가능자 우대[학력]무관[경력]신입', '[필요역량]고등 수학 교과 내용 파악 및 이해[면허/자격]수학 또는 수학교육 전공자중고등 수학 교재 및 교과서 개발 유경험자 우대[학력]대졸[경력]4~6(7~9)년신입', '[필요역량]초등수학 교과 내용 파악 및 이해자초등수학 교재 기획 및 개발 역량 보유자[면허/자격]수학 또는 수학교육 전공자[학력]대졸[경력]4~6(7~9)년7~9(4~6)년', '[필요역량]교재 개발 업무 역량(기획/ 원고 작성/ 원고 검토/ 편집 및 교정)후배 육성 역량 및 동료와 소통 역량[면허/자격]수학 또는 수학교육 전공자15개정 초등수학 교육과정에 대한 이해 및 교재 개발 경력[학력]대졸[경력]10~12(13~15)년', '[필요역량]중고등 과학(물리학) 교과 내용 파악 및 이해자중고등 과학(물리학) 교재 기획 및 개발 능력중고등 과학 교수 경험자 우대과학 교과서 개발 경험 우대[면허/자격]물리학 관련 졸업자 및 졸업예정자2급 정교사 자격증 우대[학력]대졸[경력]4~6년(신입)', '[필요역량]신규 웹서비스 설계 및 자사 사이트 운영데이터 분석 및 UX/UI 이해도에 기반한 Front/Back-end 설계Microsoft Office 활용능력 (중/상급)적극적이고 능동적인 업무 수행 태도 및 소통 역량[면허/자격]모바일 웹, 앱 기획 및 PL 경험자 우대[학력]대졸[경력]4~6년', '[필요역량]중고등 역사 교육과정 이해중고등 역사 교재, 교과서 개발 경험업무 주도성 및 소통 능력[면허/자격]사학, 역사 교육, 문화 콘텐츠학 등 역사 관련 전공자[학력]대졸[경력]4~6(1~3)년', '[필요역량]디자인 기획력열린 사고와 원활한 소통력색채와 타이포그래피에 대한 이해디자인 트랜드에 대한 관심[면허/자격]디자인 관련 전공자 또는 경력자디자인 툴 능통자(인디자인, 포토샵, 일러스트)부도, 교과서, 교재 디자인 개발 경험 우대[학력]전문대졸[경력]4~6(1~3)년', '[필요역량]Web 기획영어FC(학원)사이트 운영 능력고객 요구사항 분석 및 운영LMS 기획 및 운영[면허/자격]초등영어 FC WEB 기획 및 서비스 운영 경력자[학력]대졸[경력]4~6(1~3)년', '[필요역량]초등 영어학원FC 영업&기획FC지사관리 및 지원학원가맹 사업설명회 지원 및 지역 마켓팅 유경험자[면허/자격]초등FC 유경험자FC 가맹사업 유경험자[학력]대졸[경력]4~6(7~9)년', '[필요역량]새로운 서비스를 생각할 수 있는 창의적인 사고시스템의 로직을 설계할 수 있는 논리적인 사고디지털 기술에 대한 이해열린 커뮤니케이션[면허/자격]IT관련 전공자 우대[학력]전문대졸[경력]4~6년', '[필요역량]일어 구사력 필수, 비즈니스 상담 가능자 (면접시 테스트 진행)해외영업 경험 필수해외영업네트워크 관리 경험 우대해외전시회 관련 경험 우대[면허/자격]해외출장 결격사유 없어야 함[학력]대졸[경력]7~9년', '[필요역량]초등 영어학원FC 교육&교수설계 직무 경험 영어FC지사&가맹점 교육 유경험자영어학원 설명회 강의 및 기획 유경험자[면허/자격]초등 FC 영어 교육&교수설계 유경험자[학력]대졸[경력]7~9(4~6)년', '[필요역량]커뮤니케이션 능력 및 서비스 기획에 대한 이해초등 교육과정에 대한 이해영어교과내용 파악 및 이해[면허/자격]초등 FC 영어 강의 유경험자영어전공자 우대[학력]대졸[경력]신입', '[필요역량]한국어 사이트 기획 및 프로모션. 회원운영에 필요한 기획능력프로젝트성 기획업무 경험업무 소통의 능력 (디자이너, 퍼블리싱. 개발자와의 IT 소통능력필요)영어능력자 우대[면허/자격]온라인 교육사이트 운영 경험자 우대Web Agency 경력자[학력]전문대졸[경력]1~3년', '[필요역량]스마트컨텐츠 프로그램 업무에 필요한 능력 (교재의 스마트컨텐츠 기획, 멀티미디어 콘텐츠(영상, 음성) 진행, 디지털라이징)교재 제작(교재 제작을 위한 저자 소통 및 매니지먼트)외주 관리(아웃소싱 업체의 품질, 일정 관리 등)[면허/자격]교육사이트 스컨기획 경험자 우대이러닝 사이트 경험자 우대한국어자격증 소지[학력]전문대졸[경력]4~6년', '[필요역량]초등영어 커리큘럼 기획초등영어 컨텐츠 기획/개발관리초등영어 교재 기획/개발관리초등영어 스마트러닝 기획/개발관리[면허/자격]초등영어학원 경험자 우대ELT교재 개발 경험자 우대영어능통자 우대[학력]대졸[경력]10~12(13~15)년', '[필요역량]영어 컨텐츠 기획/개발영어 교재 기획/개발영어 스마트러닝 기획/개발[면허/자격]초등영어학원 경험자 우대ELT교재 개발 경험자 우대영어능통자 우대[학력]대졸[경력]7~9(10~12)년', '[필요역량]스마트러닝 교수설계스마트러닝 컨텐츠 기획/개발 관리[면허/자격]교육학 전공자 우대영어/수학 전공 자 우대[학력]대졸[경력]4~6(7~9)년', '[필요역량]교육용 영상기획 및 영상개발관리[면허/자격]영상 관련 업무 경험자 우대영상 편집 SW 사용 가능자 우대영어 가능자 우대[학력]전문대졸[경력]4~6(7~9)년', '[필요역량]웹/모바일 교육서비스 기획/개발교육시스템 기획/개발/운영(CMS, LMS 등)프로젝트 PM 역량[면허/자격]온라인 교육사이트 운영 경험자 우대Web Agency 경력자 우대Database 관련 역령 보유자 우대IT시스템 설계역량 보유자 우대[학력]전문대졸[경력]10~12(13~15)년', '[필요역량]웹/모바일 서비스 기획/개발관리교육시스템 기획/개발/운영(CMS, LMS 등)[면허/자격]온라인 교육사이트 운영 경험자 우대Web Agency 경력자 우대[학력]전문대졸[경력]7~9(10~12)년', '[필요역량]MS-SQL 가능자 (함수/프로시저, update/insert/select 등 쿼리 운용 숙련자)MS엑셀 능숙자(함수/VBA)[면허/자격]엑셀VBA 가능자 우대웹(asp, javascript) 개발 가능자 우대[학력]전문대졸[경력]1~3(4~6)년', '[필요역량]온라인학습물 기획/개발영어학습 콘텐츠 기획프로젝트 관리 능력(PM역량)[면허/자격]컴퓨터활용능력관련 자격 우대영어가능자[학력]전문대졸[경력]1~3(4~6)년', '[필요역량]영어학습물 UI제작 역량기본적 디자인 역량그래픽소프트웨어(포토샵 등) 운용 역량[면허/자격]디자인 자격증 우대[학력]전문대졸[경력]1~3(4~6)년', '[필요역량]이러닝 상품 전략 수립 및 프로모션 기획데이터 지표, 고객 요구 사항 분석 및 문제해결 능력교육사업에 대한 이해도가 높고 책임감이 투절한 자적극적이고 원만한 대인관계 및 커뮤니케이션[면허/자격]엑셀/PPT 등 OA 활용 수준 중 이상마케팅/기획 관련 업무 有 경험자[학력]전문대졸[경력]4~6년', '[필요역량]이러닝 강의에 대한 이해프리미어, 파이널컷프로, 에프터이펙트 등 편집, 모션 소프트웨어 사용 가능자포토샵 사용 가능자원할한 커뮤니케이션 가능자[면허/자격]온라인 교육사이트 경험자 우대영상관련 전공자 우대[학력]전문대졸[경력]1~3년(신입)', '[필요역량]중등 사이트 운영에 필요한 온라인 강좌 기획, 홍보강사 및 내부 직원간의 원활한 커뮤니케이션 능력초, 중등 교과 및 교육과정에 대한이해고객 요구사항 분석 및 대응능력[면허/자격]중, 고등 온라인 교육사이트 컨텐츠 기획/운영 경험자 우대[학력]대졸[경력]4~6(1~3)년', '[필요역량]언어 : asp 및 .net (javascript, php및 jsp가능자 우대)DB : ms-sql관리 및 개발서버 : 윈도우즈 서버[면허/자격]IT관련 자격증 소지자 우대[학력]무관[경력]1~3(4~7)년', '[필요역량]유사센터 운영 경험(필수)센터 이슈 대응 능력프로그램 개발 역량고객 응대 역량[면허/자격]체육관련 자격레크레이션 자격소방안전시설 운영 자격응급구조 자격[학력]전문대졸[경력]8~12년', '[필요역량]CRM솔루션 운영 경험웹/SNS 마케팅 경험이벤트 기획센터운영 지원[면허/자격]Web Agency 출신 우대[학력]대졸[경력]4~7년', '[필요역량]유아 교사를 위한 멀티미디어 콘텐츠 기획누리과정 및 표준보육과정의 이해유아교육 현장과 시장에 대한 이해[면허/자격]유치원 정교사 및 보육교사 소지자 우대[학력]대졸[경력]7~9(4~6)년', '[필요역량]연수원 사이트 운영고객관리 및 고객대응 경험연수원 행정운영 경험교육 서비스 운영 경험[면허/자격]온라인 교육사이트 운영 경험자 우대[학력]전문대졸[경력]신입', '[필요역량]대내외 서비스 시스템 운용 관리 담당서버(ms, linux) 설치 운용 관리네트워크 L2, L3, L4 구축 및 운용 관리보안 DDOS, IPS, FW, WFW 운용 관리시스템 장애대응, 정보보안, IDC 운용 경험DB(MSSQL, MYSQL) 운용 경험[면허/자격]서버 관련 자격 (MCP, MCSA)네트워크[학력]대졸[경력]4~6년', '[필요역량]정보보호관리체계(ISMS) 운영 및 인증 경험기업 정보보안-개인정보보안 업무 경험(3년이상)서버/DB/네트워크 등 정보보호 업무(기술적) 이해원만한 의사소통 능력[면허/자격]정보보안 유관학과 전공자정보보안관련 자격증 소지자 우대[학력]대졸[경력]4~6년', '[필요역량]회계전공자(경영학 등 상경계열 포함)반기 법인결산 경험 2회 이상재무제표 작성법인세, 부가세, 원천세 신고[면허/자격]K-IFRS 결산경험자 우대재경관리사등 회계 및 세무자격증 소지자, CPA 및 CTA 준비 경험자 우대[학력]대졸[경력]4~6(1~3)년', '[필요역량]경영기획/재무경력자경영/회계 관련 전공[면허/자격]내부감사/회계/경영 지도 관련 자격증 소지자 우대[학력]대졸[경력]4~7년'], '채용형태': ['계약직', '정규직', '계약직', '정규직', '정규직', '정규직', '정규직', '정규직', '계약직', '계약직', '정규직', '정규직', '정규직', '정규직', '정규직', '정규직', '정규직', '계약직', '정규직', '정규직', '정규직', '계약직', '정규직', '정규직', '정규직', '정규직', '계약직', '정규직', '계약직', '정규직', '정규직', '정규직', '정규직', '정규직', '계약직', '정규직', '정규직', '정규직', '정규직']}


